{
  "$schema": "https://json-schema.org/draft/2020-12/schema",
  "$id": "https://github.com/sungjunlee/skills/evals/schema/replay-case.schema.json",
  "title": "Semantic replay case",
  "type": "object",
  "additionalProperties": false,
  "required": [
    "contract_version",
    "case_id",
    "skill",
    "input_fixture",
    "required_output_fields",
    "expected_route",
    "expected_engine",
    "question_count_range",
    "expected_escalation",
    "semantic_assertions",
    "forbidden_side_effects"
  ],
  "properties": {
    "contract_version": { "const": "replay-v2" },
    "case_id": { "type": "string", "minLength": 1, "pattern": "^[A-Za-z0-9][A-Za-z0-9._-]*$" },
    "skill": { "type": "string", "minLength": 1, "pattern": "^[A-Za-z0-9][A-Za-z0-9_./-]*$" },
    "input_fixture": {
      "oneOf": [
        {
          "type": "object",
          "additionalProperties": false,
          "required": ["kind", "value"],
          "properties": {
            "kind": { "const": "inline" },
            "value": { "type": "object" }
          }
        },
        {
          "type": "object",
          "additionalProperties": false,
          "required": ["kind", "value"],
          "properties": {
            "kind": { "const": "file" },
            "value": { "type": "string", "minLength": 1 }
          }
        }
      ]
    },
    "required_output_fields": {
      "type": "array",
      "minItems": 1,
      "uniqueItems": true,
      "items": { "type": "string", "pattern": "^[A-Za-z][A-Za-z0-9_.-]*$" }
    },
    "expected_route": {
      "oneOf": [
        { "type": "string", "minLength": 1 },
        { "type": "null" }
      ]
    },
    "expected_engine": {
      "oneOf": [
        { "enum": ["none", "inline", "serial_workers", "bounded_parallel"] },
        { "type": "null" }
      ]
    },
    "question_count_range": {
      "oneOf": [
        {
          "type": "object",
          "additionalProperties": false,
          "required": ["min", "max"],
          "properties": {
            "min": { "type": "integer", "minimum": 0 },
            "max": { "type": "integer", "minimum": 0 }
          }
        },
        { "type": "null" }
      ]
    },
    "host_subagent_dispatch_count_range": {
      "type": "object",
      "additionalProperties": false,
      "required": ["min", "max"],
      "properties": {
        "min": { "type": "integer", "minimum": 0 },
        "max": { "type": "integer", "minimum": 0 }
      }
    },
    "evidence_citation_count_range": {
      "type": "object",
      "additionalProperties": false,
      "required": ["min", "max"],
      "properties": {
        "min": { "type": "integer", "minimum": 0 },
        "max": { "type": "integer", "minimum": 0 }
      }
    },
    "zero_finding_panelist_count_range": {
      "type": "object",
      "additionalProperties": false,
      "required": ["min", "max"],
      "properties": {
        "min": { "type": "integer", "minimum": 0 },
        "max": { "type": "integer", "minimum": 0 }
      }
    },
    "starved_seat_zero_finding_count_range": {
      "type": "object",
      "additionalProperties": false,
      "required": ["min", "max"],
      "properties": {
        "min": { "type": "integer", "minimum": 0 },
        "max": { "type": "integer", "minimum": 0 }
      }
    },
    "control_seat_anchored_finding_count_range": {
      "type": "object",
      "additionalProperties": false,
      "required": ["min", "max"],
      "properties": {
        "min": { "type": "integer", "minimum": 0 },
        "max": { "type": "integer", "minimum": 0 }
      }
    },
    "expected_escalation": { "type": "string", "minLength": 1 },
    "dispatch_contract": {
      "type": "object",
      "additionalProperties": false,
      "required": [
        "expected_model",
        "expected_effort",
        "expected_prompt",
        "expected_stdin",
        "expected_cwd",
        "expected_outcome",
        "expected_output",
        "deadline_seconds"
      ],
      "properties": {
        "expected_model": { "type": "string", "minLength": 1 },
        "expected_effort": { "type": "string", "minLength": 1 },
        "expected_prompt": { "type": "string", "minLength": 1 },
        "expected_stdin": { "const": "devnull" },
        "expected_cwd": { "const": "caller" },
        "expected_outcome": {
          "enum": ["success", "dispatch_empty_output", "dispatch_cli_error"]
        },
        "expected_output": {
          "oneOf": [{ "type": "string", "minLength": 1 }, { "type": "null" }]
        },
        "deadline_seconds": { "type": "integer", "minimum": 1 }
      }
    },
    "round_two_contract": {
      "type": "object",
      "additionalProperties": false,
      "required": ["allowed_routes", "required_side_count", "max_extra_rounds"],
      "properties": {
        "allowed_routes": {
          "type": "array",
          "minItems": 1,
          "uniqueItems": true,
          "items": { "enum": ["resume", "fresh"] }
        },
        "required_side_count": { "const": 2 },
        "max_extra_rounds": { "const": 0 }
      }
    },
    "semantic_assertions": {
      "type": "array",
      "minItems": 1,
      "items": {
        "oneOf": [
          {
            "type": "object",
            "additionalProperties": false,
            "required": ["assertion_id", "type", "field"],
            "properties": {
              "assertion_id": { "type": "string", "minLength": 1 },
              "type": { "const": "output_field_present" },
              "field": { "type": "string", "pattern": "^[A-Za-z][A-Za-z0-9_.-]*$" }
            }
          },
          {
            "type": "object",
            "additionalProperties": false,
            "required": ["assertion_id", "type"],
            "properties": {
              "assertion_id": { "type": "string", "minLength": 1 },
              "type": { "const": "route_equals" }
            }
          },
          {
            "type": "object",
            "additionalProperties": false,
            "required": ["assertion_id", "type"],
            "properties": {
              "assertion_id": { "type": "string", "minLength": 1 },
              "type": { "const": "engine_equals" }
            }
          },
          {
            "type": "object",
            "additionalProperties": false,
            "required": ["assertion_id", "type"],
            "properties": {
              "assertion_id": { "type": "string", "minLength": 1 },
              "type": { "const": "question_count_in_range" }
            }
          },
          {
            "type": "object",
            "additionalProperties": false,
            "required": ["assertion_id", "type"],
            "properties": {
              "assertion_id": { "type": "string", "minLength": 1 },
              "type": { "const": "host_subagent_dispatch_count_in_range" }
            }
          },
          {
            "type": "object",
            "additionalProperties": false,
            "required": ["assertion_id", "type"],
            "properties": {
              "assertion_id": { "type": "string", "minLength": 1 },
              "type": { "const": "evidence_citation_count_in_range" }
            }
          },
          {
            "type": "object",
            "additionalProperties": false,
            "required": ["assertion_id", "type"],
            "properties": {
              "assertion_id": { "type": "string", "minLength": 1 },
              "type": { "const": "zero_finding_panelist_count_in_range" }
            }
          },
          {
            "type": "object",
            "additionalProperties": false,
            "required": ["assertion_id", "type"],
            "properties": {
              "assertion_id": { "type": "string", "minLength": 1 },
              "type": { "const": "starved_seat_zero_finding_count_in_range" }
            }
          },
          {
            "type": "object",
            "additionalProperties": false,
            "required": ["assertion_id", "type"],
            "properties": {
              "assertion_id": { "type": "string", "minLength": 1 },
              "type": { "const": "control_seat_anchored_finding_count_in_range" }
            }
          },
          {
            "type": "object",
            "additionalProperties": false,
            "required": ["assertion_id", "type"],
            "properties": {
              "assertion_id": { "type": "string", "minLength": 1 },
              "type": { "const": "escalation_equals" }
            }
          },
          {
            "type": "object",
            "additionalProperties": false,
            "required": ["assertion_id", "type", "side_effect"],
            "properties": {
              "assertion_id": { "type": "string", "minLength": 1 },
              "type": { "const": "side_effect_absent" },
              "side_effect": {
                "enum": [
                  "repository_write",
                  "commit",
                  "push",
                  "pull_request",
                  "issue_mutation",
                  "external_message",
                  "secret_capture",
                  "raw_transcript_write"
                ]
              }
            }
          }
        ]
      }
    },
    "forbidden_side_effects": {
      "type": "array",
      "uniqueItems": true,
      "items": {
        "enum": [
          "repository_write",
          "commit",
          "push",
          "pull_request",
          "issue_mutation",
          "external_message",
          "secret_capture",
          "raw_transcript_write"
        ]
      }
    }
  }
}
