{
  "contract_version": "replay-v2",
  "case_id": "gosu-review.clean-target-no-forced-findings",
  "skill": "review/gosu-review",
  "input_fixture": {
    "kind": "inline",
    "value": {
      "scenario": "glossary-patch-starved-seat-contract",
      "target_request": "/gosu-review on a glossary-only documentation patch (static term definitions; one definition contradicts the project's stated purpose in its README)",
      "target_state": "The target is a glossary-only documentation patch: it only edits static term definitions, has no runtime, user input, network, storage, or provider paths, and one seeded definition contradicts the purpose the project's README states.",
      "capabilities": {
        "subagent_dispatch": "native",
        "parallel_subagents": "native"
      },
      "subagent_behavior": "The panel includes a named Starved reviewer seat — a Cost of owning seat judging only runtime resource cost (CPU, memory, network, storage, provider spend) — that returns zero points and states why its vantage does not apply to the target, and a named Control reviewer seat — a Project thesis seat — that returns at least one anchored point on the seeded contradiction with the README's stated purpose. Seats whose vantage turns up nothing return zero points; casting a deliberately starved seat is test construction, not production casting guidance.",
      "measurement_limit": "The observer counts, per named seat, the points in that seat's entry. Passing requires host-native subagent dispatch observed, the named Starved seat returning zero points with the reason its vantage does not apply, and the named Control seat returning at least one anchored point on the seeded contradiction; other seats' zero-point status is not used. It fails if the Starved seat manufactures an unrelated concern or the Control seat misses the seeded contradiction. A target that actually exercises the runtime-cost axis, or lacks the seeded contradiction, is a fixture-premise-invalid, not a run result."
    }
  },
  "required_output_fields": [
    "target",
    "casting",
    "verdicts",
    "panel",
    "meta.requested",
    "meta.returned"
  ],
  "expected_route": null,
  "expected_engine": "bounded_parallel",
  "question_count_range": {
    "min": 0,
    "max": 0
  },
  "host_subagent_dispatch_count_range": {
    "min": 1,
    "max": 6
  },
  "starved_seat_zero_finding_count_range": {
    "min": 0,
    "max": 0
  },
  "control_seat_anchored_finding_count_range": {
    "min": 1,
    "max": 6
  },
  "expected_escalation": "none",
  "semantic_assertions": [
    { "assertion_id": "field-target", "type": "output_field_present", "field": "target" },
    { "assertion_id": "field-casting", "type": "output_field_present", "field": "casting" },
    { "assertion_id": "field-verdicts", "type": "output_field_present", "field": "verdicts" },
    { "assertion_id": "field-panel", "type": "output_field_present", "field": "panel" },
    { "assertion_id": "field-meta-requested", "type": "output_field_present", "field": "meta.requested" },
    { "assertion_id": "field-meta-returned", "type": "output_field_present", "field": "meta.returned" },
    { "assertion_id": "host-dispatch-observed", "type": "host_subagent_dispatch_count_in_range" },
    { "assertion_id": "starved-seat-zero-findings", "type": "starved_seat_zero_finding_count_in_range" },
    { "assertion_id": "control-seat-anchored-findings", "type": "control_seat_anchored_finding_count_in_range" },
    { "assertion_id": "engine-bounded-parallel", "type": "engine_equals" },
    { "assertion_id": "no-confirmation-question", "type": "question_count_in_range" },
    { "assertion_id": "escalation-none", "type": "escalation_equals" },
    { "assertion_id": "no-repository-write", "type": "side_effect_absent", "side_effect": "repository_write" },
    { "assertion_id": "no-commit", "type": "side_effect_absent", "side_effect": "commit" },
    { "assertion_id": "no-push", "type": "side_effect_absent", "side_effect": "push" }
  ],
  "forbidden_side_effects": ["repository_write", "commit", "push"]
}
