{
  "contract_version": "replay-v2",
  "case_id": "fixture.dispatch-success",
  "skill": "productivity/delegate",
  "input_fixture": {
    "kind": "inline",
    "value": {
      "scenario": "dispatch-contract-success"
    }
  },
  "required_output_fields": ["output"],
  "expected_route": "reasonix/dispatch-replay-model",
  "expected_engine": null,
  "question_count_range": {
    "min": 0,
    "max": 0
  },
  "expected_escalation": "none",
  "dispatch_contract": {
    "expected_model": "dispatch-replay-model",
    "expected_effort": "high",
    "expected_prompt": "Reply with exactly: DISPATCH_REPLAY_OK",
    "expected_stdin": "devnull",
    "expected_cwd": "caller",
    "expected_outcome": "success",
    "expected_output": "DISPATCH_REPLAY_OK",
    "deadline_seconds": 90
  },
  "semantic_assertions": [
    { "assertion_id": "field-output", "type": "output_field_present", "field": "output" },
    { "assertion_id": "route", "type": "route_equals" },
    { "assertion_id": "questions", "type": "question_count_in_range" },
    { "assertion_id": "escalation", "type": "escalation_equals" }
  ],
  "forbidden_side_effects": []
}
